{
  "Id": 5857,
  "Url": null,
  "FirstName": "Jane Smith",
  "LastName": "Jane Smith",
  "Organization": "example-value",
  "Email": "member@example.com",
  "DisplayName": "Jane Smith",
  "ProfileLastUpdated": "2026-05-03",
  "MembershipLevel": null,
  "MembershipEnabled": true,
  "Status": "PendingRenewal",
  "IsAccountAdministrator": true,
  "TermsOfUseAccepted": true,
  "FieldValues": [
    null
  ]
}